{
  "id": "readiness-fixture-team",
  "subject": "Fixture team (fictional test data)",
  "framework": {
    "name": "Fixture readiness framework",
    "citation": {
      "url": "https://example.org/fixture/readiness-framework",
      "publisher": "Example Journal",
      "publishedOn": "2021-01-15",
      "retrievedOn": "2026-10-01",
      "title": "Fixture framework paper"
    },
    "label": "real"
  },
  "categories": [
    {
      "key": "strategic-alignment",
      "name": "Strategic alignment",
      "answers": [
        {
          "question": "zebra-strategic-alignment-question: a synthetic dossier question?",
          "answer": "zebra-strategic-alignment-answer: a synthetic dossier answer."
        }
      ],
      "finding": "zebra-strategic-alignment-finding: a synthetic finding in prose."
    },
    {
      "key": "resources",
      "name": "Resources",
      "answers": [
        {
          "question": "zebra-resources-question: a synthetic dossier question?",
          "answer": "zebra-resources-answer: a synthetic dossier answer."
        }
      ],
      "finding": "zebra-resources-finding: a synthetic finding in prose."
    },
    {
      "key": "knowledge",
      "name": "Knowledge",
      "answers": [
        {
          "question": "zebra-knowledge-question: a synthetic dossier question?",
          "answer": "zebra-knowledge-answer: a synthetic dossier answer."
        }
      ],
      "finding": "zebra-knowledge-finding: a synthetic finding in prose."
    },
    {
      "key": "culture",
      "name": "Culture",
      "answers": [
        {
          "question": "zebra-culture-question: a synthetic dossier question?",
          "answer": "zebra-culture-answer: a synthetic dossier answer."
        }
      ],
      "finding": "zebra-culture-finding: a synthetic finding in prose."
    },
    {
      "key": "data",
      "name": "Data",
      "answers": [
        {
          "question": "zebra-data-question: a synthetic dossier question?",
          "answer": "zebra-data-answer: a synthetic dossier answer."
        }
      ],
      "finding": "zebra-data-finding: a synthetic finding in prose."
    }
  ],
  "label": "fictional",
  "provenance": {
    "sourceUrl": null,
    "publisher": null,
    "publishedOn": null,
    "retrievedOn": null,
    "producedBy": [
      "persona-researcher"
    ],
    "producedOn": "2026-10-04",
    "frozenOn": "2026-10-05"
  },
  "maturity": {
    "status": "unverified",
    "report": null,
    "practices": [
      {
        "key": "scanning",
        "name": "Scanning",
        "levelName": "LEVEL_NAME_UNVERIFIED",
        "betweenLevels": null,
        "explanation": null,
        "nextLevel": null
      },
      {
        "key": "trend-analysis",
        "name": "Trend analysis",
        "levelName": "LEVEL_NAME_UNVERIFIED",
        "betweenLevels": null,
        "explanation": null,
        "nextLevel": null
      },
      {
        "key": "scenario-work",
        "name": "Scenario work",
        "levelName": "LEVEL_NAME_UNVERIFIED",
        "betweenLevels": null,
        "explanation": null,
        "nextLevel": null
      }
    ]
  }
}
